<!ELEMENT project (title, summary, todoList)>
<!ELEMENT title (#PCDATA)>
<!ELEMENT summary (#PCDATA)>
<!ELEMENT todoList (title, (todoList|todoItem)*)>
<!ELEMENT todoItem (title, completed)>
<!ELEMENT completed (#PCDATA)>